{
  "$schema": "../../schema/template.schema.json",
  "id": "code/unit-tests-for-function",
  "title": "Unit tests for a function",
  "description": "Generates focused unit tests grounded in a specification when you have one: behaviors are tagged as specified, observed or assumed, so the model never invents the contract.",
  "category": "engineering",
  "modality": "code",
  "engine": null,
  "language": "en",
  "version": "1.1.0",
  "authors": [
    "SpicesFire"
  ],
  "tags": [
    "testing",
    "unit-tests"
  ],
  "variables": [
    {
      "name": "code",
      "description": "The function or module under test",
      "required": true,
      "example": "export function slugify(input: string): string { ... }"
    },
    {
      "name": "specification",
      "description": "Authoritative requirements for the code: ticket, docs or acceptance criteria",
      "required": false,
      "example": "slugify must lowercase, trim, collapse every run of characters outside [a-z0-9] into a single hyphen and strip leading and trailing hyphens. Non-ASCII letters are removed, not transliterated."
    },
    {
      "name": "framework",
      "description": "Test framework and language",
      "required": true,
      "example": "Vitest with TypeScript"
    },
    {
      "name": "existing_test_example",
      "description": "A short existing test from the codebase, so style matches",
      "required": false,
      "example": "it('returns empty string for empty input', () => { expect(slugify('')).toBe('') })"
    }
  ],
  "template": "You are a senior engineer who writes tests that catch real bugs, not tests that restate the implementation.\n\nCode under test:\n```\n{{code}}\n```\n\nSpecification (authoritative; may be empty):\n\"\"\"\n{{specification}}\n\"\"\"\n\nFramework: {{framework}}\nMatch the style of this existing test (naming, assertion style, structure):\n```\n{{existing_test_example}}\n```\n\nProcess:\n1. First, list the function's observable behaviors in 3-8 bullets. Tag each one SPEC if the specification states it, OBSERVED if the current code does it and the specification is silent, or ASSUMED if neither covers it and you would be guessing the intent.\n2. List edge cases: empty and boundary inputs, unusual types or encodings, error paths, and anything order- or time-dependent.\n3. Then write the tests.\n\nTest rules:\n- Test behavior through the public interface only; do not assert on private helpers or call counts unless that is the contract.\n- One behavior per test, named as a sentence describing that behavior.\n- No mocks unless the code touches the network, filesystem, clock or randomness; when it does, control those explicitly.\n- Only SPEC behaviors may be asserted as correct. Pin OBSERVED behaviors as current behavior, with test names starting \"currently\". Do not write tests for ASSUMED behaviors; list them under \"Questions for the author\" instead.\n- If the code contradicts the specification, write the test for the specified behavior and mark it with a comment starting \"SPEC VIOLATION:\".\n\nOutput the tagged behavior list, the edge-case list, questions for the author (if any), then one complete, runnable test file.",
  "example": {
    "code": "export function slugify(input: string): string {\n  return input.toLowerCase().trim().replace(/[^a-z0-9]+/g, '-').replace(/^-|-$/g, '');\n}",
    "specification": "slugify must lowercase, trim, collapse every run of characters outside [a-z0-9] into a single hyphen and strip leading and trailing hyphens. Non-ASCII letters are removed, not transliterated.",
    "framework": "Vitest with TypeScript",
    "existing_test_example": "it('returns empty string for empty input', () => { expect(slugify('')).toBe('') })"
  }
}
